{
  "event_id": "evt_aaaaaaaaaaaaaaaaaaaaaaaaaaaaaaaa",
  "kind": "transfer-authorized",
  "schema_version": 1,
  "network": "testnet",
  "provenance": {
    "origin": "derived",
    "source": "safeguard-audit",
    "parser_version": "1.0.0",
    "derivation": {
      "method": "transaction-outcome-analysis",
      "source_events": [],
      "note": "transfer outcome reconstructed from the recorded transaction and enforcement decision"
    }
  },
  "observed_at": 1700000100,
  "order": { "ledger_sequence": 420, "operation_index": 0, "event_index": null },
  "transaction": { "network": "testnet", "hash": "abababababababababababababababababababababababababababababababab" },
  "token": { "network": "testnet", "contract": "CCONFIDENTIALTOKENDEMO000000000000000000000000000000" },
  "actor": { "network": "testnet", "account": "GASENDERACCOUNTDEMO0000000000000000000000000000000000" },
  "subject": { "network": "testnet", "account": "GCRECEIVERACCOUNTDEMO00000000000000000000000000000000" },
  "outcome": "allowed",
  "reason": "OK"
}
